{
  "$schema": "https://json-schema.org/draft/2020-12/schema",
  "$id": "ipcraft.tool-input.v1",
  "title": "Ipcraft Tool Input Manifest V1",
  "type": "object",
  "additionalProperties": false,
  "required": [
    "schema", "pipelineRunId", "stepId", "invocationId", "toolLockId", "kind",
    "snapshotSessionRevision", "snapshotDigest", "formallySavedProjectDigest",
    "dependencies", "projectDesignFile", "resultFile", "reportDirectory"
  ],
  "properties": {
    "schema": { "const": "ipcraft.tool-input.v1" },
    "pipelineRunId": { "$ref": "#/$defs/id" },
    "stepId": { "$ref": "#/$defs/id" },
    "invocationId": { "$ref": "#/$defs/id" },
    "toolLockId": { "$ref": "#/$defs/id" },
    "kind": { "enum": ["semantic-drc", "generator"] },
    "snapshotSessionRevision": { "type": "integer", "minimum": 0 },
    "snapshotDigest": { "$ref": "#/$defs/digest" },
    "formallySavedProjectDigest": {
      "oneOf": [{ "$ref": "#/$defs/digest" }, { "type": "null" }]
    },
    "dependencies": {
      "type": "array",
      "x-ipcraft-canonical": { "kind": "set", "sortKey": ["lockId"] },
      "$comment": "lockId uniqueness and sorting are semantic-validator rules.",
      "items": { "$ref": "ipcraft.project-design.v1.schema.json#/$defs/dependencyLock" }
    },
    "projectDesignFile": { "$ref": "#/$defs/path" },
    "resultFile": { "$ref": "#/$defs/path" },
    "reportDirectory": { "$ref": "#/$defs/path" },
    "outputDirectory": { "$ref": "#/$defs/path" }
  },
  "allOf": [
    {
      "if": { "properties": { "kind": { "const": "generator" } }, "required": ["kind"] },
      "then": {
        "$comment": "Generator semantic validation MUST require formallySavedProjectDigest to equal snapshotDigest; Draft 2020-12 cannot compare arbitrary property values.",
        "required": ["outputDirectory", "snapshotDigest", "formallySavedProjectDigest"],
        "properties": {
          "outputDirectory": { "$ref": "#/$defs/path" },
          "snapshotDigest": { "$ref": "#/$defs/digest" },
          "formallySavedProjectDigest": { "$ref": "#/$defs/digest" }
        }
      },
      "else": { "not": { "required": ["outputDirectory"] } }
    }
  ],
  "$defs": {
    "id": { "type": "string", "minLength": 1 },
    "digest": { "type": "string", "pattern": "^sha256:[0-9a-f]{64}$" },
    "path": {
      "type": "string",
      "$comment": "Semantic validation MUST enforce NFC, Windows reserved device names and trailing-dot/space rules, Unicode simple-case-fold collision detection, and exhaustive filesystem containment because JSON Schema regex cannot prove them.",
      "pattern": "^(?!.*[\\u0000-\\u001F\\u007F:])(?!.*\\\\)(?!.*(?:^|/)\\.{1,2}(?:/|$))[^/]+(?:/[^/]+)*$"
    }
  }
}
